{
  "$schema": "https://json-schema.org/draft/2020-12/schema",
  "title": "ProductPrepareResponse",
  "type": "object",
  "additionalProperties": false,
  "required": ["schema_version", "product_id", "product", "sections"],
  "properties": {
    "schema_version": {
      "$ref": "../common.schema.json#/$defs/SchemaVersion"
    },
    "product_id": {
      "type": "string"
    },
    "product": {
      "$ref": "../ProductJSON.schema.json"
    },
    "sections": {
      "title": "PreparedSections",
      "description": "Precomputed in parallel, in English, and translated lazily: translation and TTS run only for the section the user asks for.",
      "type": "object",
      "additionalProperties": false,
      "required": ["overview", "specs", "reviews", "images", "comparison"],
      "properties": {
        "overview": {
          "anyOf": [
            {
              "$ref": "../AccessibleOutput.schema.json"
            },
            {
              "type": "null"
            }
          ]
        },
        "specs": {
          "anyOf": [
            {
              "$ref": "../AccessibleOutput.schema.json"
            },
            {
              "type": "null"
            }
          ]
        },
        "reviews": {
          "anyOf": [
            {
              "$ref": "../AccessibleOutput.schema.json"
            },
            {
              "type": "null"
            }
          ]
        },
        "images": {
          "anyOf": [
            {
              "$ref": "../AccessibleOutput.schema.json"
            },
            {
              "type": "null"
            }
          ]
        },
        "comparison": {
          "anyOf": [
            {
              "$ref": "../AccessibleOutput.schema.json"
            },
            {
              "type": "null"
            }
          ]
        }
      }
    }
  }
}
