{
  "schema_version": "1.0",
  "product_id": "amazon.in:B0ZNTRA5G1",
  "product": {
    "schema_version": "1.0",
    "id": "amazon.in:B0ZNTRA5G1",
    "url": "https://www.amazon.in/dp/B0ZNTRA5G1",
    "site": "amazon.in",
    "title": "Zentra Pulse 5G (Midnight Black, 8GB RAM, 128GB Storage)",
    "brand": "Zentra",
    "price": {
      "amount": 17999.0,
      "currency": "INR",
      "mrp": 24999.0
    },
    "rating": {
      "value": 4.2,
      "count": 3418
    },
    "availability": {
      "status": "in_stock",
      "text": "In stock"
    },
    "category": "Smartphones",
    "specs": {
      "battery": {
        "label": "Battery Capacity",
        "value": 5000.0,
        "unit": "mAh"
      },
      "ram": {
        "label": "RAM",
        "value": 8.0,
        "unit": "GB"
      },
      "storage": {
        "label": "Internal Storage",
        "value": 128.0,
        "unit": "GB"
      },
      "display_size": {
        "label": "Screen Size",
        "value": 6.67,
        "unit": "inches"
      },
      "refresh_rate": {
        "label": "Refresh Rate",
        "value": 120.0,
        "unit": "Hz"
      },
      "os": {
        "label": "Operating System",
        "value": "Android 15",
        "unit": null
      }
    },
    "variants": [
      {
        "name": "colour",
        "value": "Midnight Black",
        "selected": true,
        "available": true,
        "target_id": "t-swatch-black"
      },
      {
        "name": "colour",
        "value": "Sage Green",
        "selected": false,
        "available": true,
        "target_id": "t-swatch-green"
      }
    ],
    "images": [
      {
        "url": "https://m.media-amazon.com/images/I/zentra-pulse-5g-front.jpg",
        "alt": "Zentra Pulse 5G front and back, Midnight Black",
        "description": null,
        "ocr_text": null
      },
      {
        "url": "https://m.media-amazon.com/images/I/zentra-pulse-5g-box.jpg",
        "alt": "What's in the box",
        "description": null,
        "ocr_text": "Handset, 33W charger, USB-C cable, SIM ejector, protective case"
      }
    ],
    "delivery": {
      "text": "FREE delivery Tuesday, 14 October",
      "cost": {
        "amount": 0.0,
        "currency": "INR"
      },
      "date": "2026-10-14"
    },
    "seller": "Zentra Official Store",
    "sponsored": false,
    "reviews": {
      "basis_count": 690,
      "summary_text": "Customers like the battery life and display. Some mention the camera struggles in low light, and opinions on heating while gaming are mixed.",
      "insights": [
        {
          "topic": "Battery life",
          "sentiment": "positive",
          "mentions": {
            "total": 212,
            "positive": 189,
            "negative": 23
          }
        },
        {
          "topic": "Display",
          "sentiment": "positive",
          "mentions": {
            "total": 148,
            "positive": 131,
            "negative": 17
          }
        },
        {
          "topic": "Low-light camera",
          "sentiment": "negative",
          "mentions": {
            "total": 96,
            "positive": 28,
            "negative": 68
          }
        },
        {
          "topic": "Heating",
          "sentiment": "mixed",
          "mentions": {
            "total": 54,
            "positive": 25,
            "negative": 29
          }
        }
      ],
      "histogram": {
        "1": 274,
        "2": 137,
        "3": 307,
        "4": 820,
        "5": 1880
      },
      "items": [
        {
          "rating": 5.0,
          "title": "Battery lasts two days",
          "text": "With normal use I charge it every second day. The screen is bright outdoors.",
          "date": "2026-09-21",
          "verified": true
        },
        {
          "rating": 4.0,
          "title": "Good value",
          "text": "Smooth for daily apps and the 120Hz screen feels fast. Night photos are average.",
          "date": "2026-09-18",
          "verified": true
        },
        {
          "rating": 2.0,
          "title": "Camera disappointing at night",
          "text": "Daylight photos are fine but indoor and night photos are noisy.",
          "date": "2026-09-12",
          "verified": true
        },
        {
          "rating": 4.0,
          "title": null,
          "text": "Gets a little warm during long games, otherwise no complaints.",
          "date": "2026-09-05",
          "verified": false
        },
        {
          "rating": 5.0,
          "title": "Easy for my father to use",
          "text": "Large text and loud speaker. He uses it for calls and UPI without help.",
          "date": "2026-08-30",
          "verified": true
        }
      ]
    },
    "source": {
      "method": "adapter",
      "extracted_at": "2026-10-10T10:00:00Z",
      "fields": {
        "title": "jsonld",
        "price": "adapter",
        "specs": "adapter",
        "reviews.insights": "serpapi"
      }
    },
    "missing": []
  },
  "sections": {
    "overview": {
      "schema_version": "1.0",
      "lang": "en",
      "summary": "Zentra Pulse 5G is priced at ₹17,999, MRP ₹24,999. It has a rating of 4.2 out of 5 from 3418 ratings.",
      "sections": [
        {
          "heading": "At a glance",
          "items": [
            {
              "text": "In stock",
              "kind": "text",
              "grounding_index": 5
            },
            {
              "text": "FREE delivery Tuesday, 14 October",
              "kind": "text",
              "grounding_index": 6
            },
            {
              "text": "Sold by Zentra Official Store",
              "kind": "text",
              "grounding_index": 7
            },
            {
              "text": "Colour: Midnight Black (selected), Sage Green",
              "kind": "text",
              "grounding_index": 11
            }
          ],
          "table": null,
          "simpler": null
        }
      ],
      "simpler": null,
      "followups": [],
      "grounding": [
        {
          "claim": "Zentra Pulse 5G",
          "subject_id": "amazon.in:B0ZNTRA5G1",
          "field_path": "title"
        },
        {
          "claim": "₹17,999",
          "subject_id": "amazon.in:B0ZNTRA5G1",
          "field_path": "price.amount"
        },
        {
          "claim": "₹24,999",
          "subject_id": "amazon.in:B0ZNTRA5G1",
          "field_path": "price.mrp"
        },
        {
          "claim": "4.2",
          "subject_id": "amazon.in:B0ZNTRA5G1",
          "field_path": "rating.value"
        },
        {
          "claim": "3418",
          "subject_id": "amazon.in:B0ZNTRA5G1",
          "field_path": "rating.count"
        },
        {
          "claim": "In stock",
          "subject_id": "amazon.in:B0ZNTRA5G1",
          "field_path": "availability.text"
        },
        {
          "claim": "FREE delivery Tuesday, 14 October",
          "subject_id": "amazon.in:B0ZNTRA5G1",
          "field_path": "delivery.text"
        },
        {
          "claim": "Zentra Official Store",
          "subject_id": "amazon.in:B0ZNTRA5G1",
          "field_path": "seller"
        },
        {
          "claim": "Midnight Black (selected), Sage Green",
          "subject_id": "amazon.in:B0ZNTRA5G1",
          "field_path": "variants"
        },
        {
          "claim": "Midnight Black",
          "subject_id": "amazon.in:B0ZNTRA5G1",
          "field_path": "variants[0].value"
        },
        {
          "claim": "Sage Green",
          "subject_id": "amazon.in:B0ZNTRA5G1",
          "field_path": "variants[1].value"
        },
        {
          "claim": "Midnight Black, Sage Green",
          "subject_id": "amazon.in:B0ZNTRA5G1",
          "field_path": "variants"
        }
      ],
      "warnings": []
    },
    "specs": {
      "schema_version": "1.0",
      "lang": "en",
      "summary": "It has a 5000 mAh battery, 8 GB RAM and 128 GB storage.",
      "sections": [
        {
          "heading": "Specs",
          "items": [
            {
              "text": "Battery Capacity: 5000 mAh",
              "kind": "spec",
              "grounding_index": 1
            },
            {
              "text": "RAM: 8 GB",
              "kind": "spec",
              "grounding_index": 2
            },
            {
              "text": "Internal Storage: 128 GB",
              "kind": "spec",
              "grounding_index": 3
            },
            {
              "text": "Screen Size: 6.67 inches",
              "kind": "spec",
              "grounding_index": 4
            },
            {
              "text": "Refresh Rate: 120 Hz",
              "kind": "spec",
              "grounding_index": 5
            },
            {
              "text": "Operating System: Android 15",
              "kind": "spec",
              "grounding_index": 6
            }
          ],
          "table": null,
          "simpler": null
        }
      ],
      "simpler": null,
      "followups": [],
      "grounding": [
        {
          "claim": "Zentra Pulse 5G",
          "subject_id": "amazon.in:B0ZNTRA5G1",
          "field_path": "title"
        },
        {
          "claim": "5000 mAh",
          "subject_id": "amazon.in:B0ZNTRA5G1",
          "field_path": "specs.battery"
        },
        {
          "claim": "8 GB",
          "subject_id": "amazon.in:B0ZNTRA5G1",
          "field_path": "specs.ram"
        },
        {
          "claim": "128 GB",
          "subject_id": "amazon.in:B0ZNTRA5G1",
          "field_path": "specs.storage"
        },
        {
          "claim": "6.67 inches",
          "subject_id": "amazon.in:B0ZNTRA5G1",
          "field_path": "specs.display_size"
        },
        {
          "claim": "120 Hz",
          "subject_id": "amazon.in:B0ZNTRA5G1",
          "field_path": "specs.refresh_rate"
        },
        {
          "claim": "Android 15",
          "subject_id": "amazon.in:B0ZNTRA5G1",